{
  "$schema": "../../schemas/variants.schema.json",
  "base": "inline-flex shrink-0 items-center justify-center gap-2 whitespace-nowrap rounded-md text-sm font-medium transition-colors outline-none focus-visible:border-ring focus-visible:ring-[3px] focus-visible:ring-ring/50 disabled:pointer-events-none disabled:opacity-50",
  "byKey": {
    "size": {
      "default": "h-9 px-4 py-2",
      "icon": "h-9 w-9",
      "lg": "h-10 rounded-md px-6",
      "sm": "h-8 gap-1.5 rounded-md px-3"
    },
    "variant": {
      "default": "bg-primary text-primary-foreground shadow-xs hover:bg-primary/90",
      "destructive": "bg-destructive text-destructive-foreground shadow-xs hover:bg-destructive/90",
      "ghost": "hover:bg-accent hover:text-accent-foreground",
      "link": "text-primary underline-offset-4 hover:underline",
      "outline": "border border-input bg-background shadow-xs hover:bg-accent hover:text-accent-foreground",
      "secondary": "bg-secondary text-secondary-foreground shadow-xs hover:bg-secondary/80"
    }
  },
  "defaults": {
    "size": "default",
    "variant": "default"
  },
  "id": "ui.button",
  "keys": [
    "variant",
    "size"
  ]
}
